{
  "schema_version": "net.health.report.v1",
  "health_report_id": "health_demo_unavailable",
  "subject_id": "capability_demo_neural_llm_decode",
  "subject_kind": "capability",
  "check_kind": "capability_readiness",
  "health_state": "unavailable",
  "observed_by_node_id": "node_local_process_demo",
  "reason": "Synthetic unavailable capability fixture.",
  "metadata": {
    "declared": true,
    "synthetic": true,
    "note": "Unavailable state is fixture material, not a real probe result."
  },
  "observed_at_unix_ms": 0
}
