{
  "schema_version": "net.health.report.v1",
  "health_report_id": "health_demo_degraded",
  "subject_id": "capability_demo_receipt_emit",
  "subject_kind": "capability",
  "check_kind": "capability_readiness",
  "health_state": "degraded",
  "observed_by_node_id": "node_local_process_demo",
  "reason": "Synthetic degraded capability fixture.",
  "metadata": {
    "declared": true,
    "synthetic": true,
    "note": "Degraded state is represented without live probing."
  },
  "observed_at_unix_ms": 0
}
