{
  "schema_version": "net.health.report.v1",
  "health_report_id": "health_demo_endpoint_liveness",
  "subject_id": "endpoint_demo_local_process",
  "subject_kind": "endpoint",
  "check_kind": "liveness",
  "health_state": "alive",
  "observed_by_node_id": "node_local_process_demo",
  "reason": "Synthetic endpoint liveness fixture.",
  "metadata": {
    "declared": true,
    "synthetic": true,
    "note": "No live endpoint probe was performed."
  },
  "observed_at_unix_ms": 0
}
