{
  "schema_version": "net.health.report.v1",
  "health_report_id": "health_demo_node_health",
  "subject_id": "node_local_process_demo",
  "subject_kind": "node",
  "check_kind": "health",
  "health_state": "alive",
  "observed_by_node_id": "node_local_process_demo",
  "reason": "Synthetic node health fixture.",
  "metadata": {
    "declared": true,
    "synthetic": true,
    "note": "Canonical example, not a real observation."
  },
  "observed_at_unix_ms": 0
}
