{
  "schema_version": "net.health.report.v1",
  "health_report_id": "health_demo_endpoint_readiness",
  "subject_id": "endpoint_demo_localhost_http",
  "subject_kind": "endpoint",
  "check_kind": "readiness",
  "health_state": "ready",
  "observed_by_node_id": "node_local_process_demo",
  "reason": "Synthetic endpoint readiness fixture.",
  "metadata": {
    "declared": true,
    "synthetic": true,
    "note": "Readiness is fixture vocabulary, not operation approval."
  },
  "observed_at_unix_ms": 0
}
