{
  "schema_version": "net.health.report.v1",
  "health_report_id": "health_demo_capability_readiness",
  "subject_id": "capability_demo_metrics_stream",
  "subject_kind": "capability",
  "check_kind": "capability_readiness",
  "health_state": "ready",
  "observed_by_node_id": "node_local_process_demo",
  "reason": "Synthetic capability readiness fixture.",
  "metadata": {
    "declared": true,
    "synthetic": true,
    "note": "Capability readiness does not grant permission."
  },
  "observed_at_unix_ms": 0
}
